Japanese,"rōshi kyōtei rōshi kyō tei to wa, rōdōsha to shiyōsha to no ma de teiketsusareru, shomen niyoru kyōtei no koto de aru. hōbunjō no katari de wa naku, kaki no yōken o mitasu kyōtei no koto o ippanni" rōshi kyōtei" to yobu hōbunjō wa" tōgai jigyōjō ni, rōdōsha no kahansū de soshikisuru rōdō kumiai ga aru toki wa sono rōdō kumiai, rōdōsha no kahansū de soshikisuru rōdō kumiai ga nai toki wa rōdōsha no kahansū o daihyōsuru mono to no shomen niyoru kyōtei". rōshi kyōtei wa, jigyōjō tan'i de teiketsusareru 1 rōdō kyōyaku no yōni sangyōbetsu ya kigyō tan'i de teiketsusuru koto wa dekinai. rōshi kyōtei o teiketsusuru koto de, rōdō kijunhō, ikuji kaigo kyūgyōhō, kō nenreisha koyōyasu jōhōtō de sadamerareta shotei no jikō nitsuite, hōtei gimu no menjo ya menbatsu no kōka o hasseisaseru. tadashi, rōshi kyōtei ni wa, rōdō kyōyaku shūgyō kisoku no yōni, rōdō keiyaku o kiritsu suru kōryoku kihanteki kōryoku wa nai node, rōshi kyōtei o teiketsushite mo sore dake de wa rōdō keiyakujō no kenri gimu wa shōjinai Shōwa 63 nen 1 tsuki 1 nichi motohatsu 1 gō. shitagatte rōshi kyōtei teiketsu to awasete rōdō kyōyaku shūgyō kisokutō de sorezore no sadame ga hitsuyō to naru."
Japanese,"Santafye no chiiki ri-gu de wa 14 do yūshōshi, 1947 nen ni Aruzenchin sakka- kyōkai ni kameishita. nani shi-zun ka wa kabu ri-gu de sugoshita ga, 1965 nen shi-zun ni Purime-Ra B tōji 2 bu de yūshōshi, purime-radhibishion 1 bu shōkaku o kimeru to 4 , toppu ri-gu hatsu sansen to natta 1966 nen shi-zun o 15 i de oeta. 1967 nen ni wa ri-gu hōshiki no kaikaku ga okonaware, 1 shi-zun o metoroporita-no to nashionaru metoroporita-no no jōi kurabu nomi ga shutsujō dekiru no 2 tsu ni bunkatsusuru hōshiki ga saiyōsareta. koron wa 1968 nen made nashionaru ni shutsujō dekizu, sonogo no sū shi-zun mo kurushinda ga, nashionaru 1972 de wa guru-pu 2 i to natta."
Polish,"Pomnik przedstawia przykutego do skały nagiego mężczyznę o zniekształconej bólem twarzy. Z przodu skały, na której leży mężczyzna, artysta umieścił ostrze kosy z wyrytym na nim napisem LE MARTYR MODERNE. Z prawej strony mężczyzny wyobrażony jest orzeł o dwóch głowach wbijający pazury i dziób w jego tors. Oryginalna rzeźba została wykonana w formie gipsowej.Zainspirowana upadkiem powstania styczniowego rzeźba powstała w 1864 roku. Poruszony narastającymi represjami zaborcy rosyjskiego autor chciał stworzyć dzieło przedstawiające w alegoryczny sposób bohaterstwo i cierpienie Polaków. Współczesny męczennik został pierwszy raz wystawiony w roku powstania na Salonie Paryskim, a obecnie znajduje się w muzeum artysty w jego rodzinnym mieście, Colmarze.O wykonaniu odlewu rzeźby we francuskiej odlewni Strassacker i sprowadzeniu jej do Polski w ramach Sezonu Polskiego we Francji zadecydował w 2005 roku Waldemar Dąbrowski, minister kultury. Od marca do czerwca 2005 roku eksponowana była na dziedzińcu Zamku Królewskiego w Warszawie. Obecnie znajduje się w zbiorach Centrum Rzeźby Polskiej w Orońsku[1]."
English,"Scientific discovery of medicinal propertiesThe trade started when Russell Marker, a chemist looking for a plant source from which to extract diosgenin and saponin, traveled to Veracruz looking for the yam Dioscorea mexicana which he suspected might be suitable. He hired two Mexican campesinos to bring him exemplars of the tuber. When he discovered that the root was indeed a significant source of diosgenin, he established Syntex, the first Mexican fine chemical company dedicated to producing semisynthetic hormones from Barbasco. Before this development, natural hormones were extracted from animal sources, such as urine from pregnant mares or women, or from bull testes; prices were consequently very high. With the development of the process of Marker degradation which allowed the production of hormones from vegetable saponin sources, Marker began a search for a plant steroid of the sapogenin class with a ring structure more like progesterone. With the discovery of the chemical properties of the barbasco root, world market prices for steroids and other synthetic hormones plummeted, making them feasible for large-scale production of medicines for common ailments such as arthritis or Addison's disease, and eventually as the basis for the combined oral contraceptive pill.[1][2]"
Japanese,"Shibuya wa isshun no senkō ni tsutsumare, amari no mabushisa ni dare mo ga me o aketeirarenakatta. katsute no sensō o taikenshita sedai naraba, machigainaku kakuheiki o sōzōshita koto darou. jissai, sugu ni kieteshimatta monono, shiroi kinoko kumo ga nan hyaku me-toru ni mo watatte Shibuya jōkū ni tachinoboru no o mita mono mo ita. tadashi sono hikari ga, nani o gen'in ni shita mono na no ka, jishin to no inga kankei wa aru no ka, nado nitsuite wa ima no tokoro issai fumei to no koto datta."
Polish,"W X wieku był to gród słowiański przy przeprawie przez Odrę, mieściła się w nim komora celna. W 1283 utracił prawa targowe na rzecz Gryfina, w 1347 miejscowość otrzymała prawa miejskie[7]. W XV wieku przez miasto przebiegała granica Pomorza i Brandenburgii. Od 1653 do 1679 Widuchowa należała do Szwecji, a następnie do Brandenburgii. W latach 1733–1788 było to prywatne miasto margrabiów ze Schwedt, w XVIII wieku było znane z jarmarków, czemu towarzyszył rozwój rzemiosła. Przed II wojną światową było znane z przetwórstwa tytoniu[8]. W 1945 Widuchowa została zniszczona w 80% i utraciła prawa miejskie, obecnie trwają starania o przywrócenie praw miejskich[9]."
English,"Daglish is a suburb located approximately 4 kilometres (2.5 mi) west of the central business district (CBD) of Perth, the capital and largest city of Western Australia, and 5 kilometres (3.1 mi) east of the Indian Ocean. It is part of Perth's affluent western suburbs. Daglish is bounded to the south-east by Railway Road, to the south by Lonnie Street, to the west by Selby Street, and to the north by Dakin Street, Wilsmore Street, Roberta Street, Jersey Street, Troy Terrace and Hay Street. To the east is the suburb of Subiaco, to the south and west is Shenton Park, and to the north is Jolimont.[2]"
Japanese,"bakkuappu o totteinakatta otakara moe irasutoshū ya san de-ta wa, munen de wa aru kedo akirameru shika nai darou. soredemo, dekirudake isoide no sai fuxo-matto sagyō o hajimetai. soshite, ensu-de-ta ga buji de aru koto o kono me de ikkoku mo hayaku tashikametai. mottomo, sono tameni wa ima boku o sainandeiru kono zutsū ga hiitemorawanaku chanaranai wake da ga."
Polish,"Na początku lat 50. Andrzej Wajda zadebiutował trzema etiudami szkolnymi: fabularnym Złym chłopcem (1951) na podstawie noweli Antona Czechowa[9], dokumentalną Ceramiką iłżecką (1951)[10] oraz dokumentalną Kiedy ty śpisz (1953)[11]. Sam reżyser uznał je za nieudane, co wynikało z amatorskiego wykonania pierwszej z nich, interwencji „koleżeńskiego kolektywu” w przypadku drugiej oraz nietrafionego konceptu trzeciej. Żadna z jego etiud nie została więc zgłoszona do pracy dyplomowej[8]. Młody filmowiec miał wziąć także udział w reżyserii socrealistycznego filmu Cztery opowieści, do którego napisał scenariusz, jednak projekt jego nowelki Kasia z tkalni numer trzy został odrzucony przez kierownictwo szkoły, a film ostatecznie otrzymał nazwę Trzy opowieści. Po ukończeniu łódzkiej szkoły filmowej Andrzej Wajda stał się współpracownikiem Aleksandra Forda, pracując przy jego filmach Młodość Chopina i Piątka z ulicy Barskiej[8]."
English,"Deer Island is a peninsula in Boston, Massachusetts. Since 1996, it has been part of the Boston Harbor Islands National Recreation Area. Although still an island by name, Deer Island has been connected to the mainland since the former Shirley Gut channel, which once separated the island from the town of Winthrop, was filled in by the 1938 New England hurricane.[1] Today, Deer Island is the location of the Deer Island Waste Water Treatment Plant, whose 150-foot-tall (46 m) egg-like sludge digesters are major harbor landmarks.[2][3]Wastewater treatment plant, water tower, Deer IslandThe island's permanent size is 185 acres (0.75 km2), plus an intertidal zone of a further 80 acres (320,000 m2). Two-thirds of the island's area is taken up with the wastewater plant, which treats sewage from 43 nearby cities and towns, and is the second-largest such plant in the United States.[4] The remainder of the island is park land surrounding the treatment plant. The area offers walking, jogging, sightseeing, picnicking and fishing activities.[2][3]"
Japanese,"itsu da. kangaero. omoidase. tashika sō, mada hiru ni wa nattenakatta hazu da. toiu koto wa Tsubuse mi :" ichi jikan ijō mo kizetsushiteta?" soretomo muyūbyō mitai ni natte, ichi jikan no ma, boku wa doko ka o samayotteta no? Tsubuse mi :" bo, boku wa muyūbyō janai" mata mo negathibuna hōkō e shizumikondeikou to suru"
